caption,url
a beautiful sunrise in the distance behind a taj mahal and a boat on the river,https://images.robertharding.com/preview/RF/RH_RF/VERTICAL/1158-345.jpg
the taj mahal mahal palace,https://elephanta.co.in/wp-content/uploads/2014/02/Taj-Mahal-Hotel-in-Mumbai.jpg
taj mahal mausoleum with beautiful blue sky background stock photography,https://thumbs.dreamstime.com/b/ivory-white-facade-taj-mahal-calligraphy-wall-ivory-white-facade-taj-mahal-calligraphy-walls-122520244.jpg
"a woman stands in front of the taj mahal, which is now the mausoleum",https://m.hindustantimes.com/rf/image_size_800x600/HT/p1/2012/01/20/Incoming/Pictures/799715_Wallpaper2.jpg
the taj mahal mausoleum from the yamunli river in india,https://images.robertharding.com/preview/RF/RH_M_RF/HORIZONTAL/794-2969.jpg
a man and a woman standing in front of the huml huml at the taj mahal mausoleum,https://static1.squarespace.com/static/537377c4e4b0a4617ea51e1d/t/54f970f8e4b08a345af4088d/1425633567406/
"the taj mahal mahal hotel, built in 1897, is seen at the waterfront of mumbai city","https://img.etimg.com/thumb/msid-47849084,width-640,resizemode-4,imgsize-68747/5-things-that-make-mumbai-an-expensive-city.jpg"
a poster of bollywood movie taj mahal,https://im.rediff.com/movies/2013/mar/07royals-in-bollywood5.jpg
"the taj mahal mosque is a famous monument in agra, india and is located in a beautiful garden with",https://images.fineartamerica.com/images/artworkimages/mediumlarge/2/entering-the-taj-mahal-at-the-sunrise-agra-india-watercolor-by-adam-asar-celestial-images.jpg
"the taj mahal, a mausoleum and reflecting pond in the middle of a lake",https://www.travelnation.co.uk/sites/default/files/india_agra_taj_mahal_sunset.jpg
a black and white drawing of the taj mahal on a coloring page,https://cdn3.minted.com/files/mintedProductsImages/MIN/MGA/WVF/20180827020618/art_group-unframed/artist_signature-unsigned/border-full_bleed/color-a/image_type-product/800x800/the-taj-mahal-in-pen.jpg?mntd_prf=Pdp:HeroImage
an open doorway to the taj mahal mausoleum,https://img.freepik.com/free-photo/views-entrance-indian-temple_119635-5.jpg?size=626&ext=jpg
"a lego taj mahal building kit, on a white background",https://assets.newatlas.com/dims4/default/c1de99b/2147483647/strip/true/crop/6397x4888+0+0/resize/1256x960!/quality/90/?url=http%3A%2F%2Fnewatlas-brightspot.s3.amazonaws.com%2Farchive%2Flego-taj-mahal-7.jpg
the taj mahal palace in lake pic credit flick,https://www.inspiredcitizen.com/wp-content/uploads/2013/09/Lake-Palace-Hotel-Udaipur8-1024x576.jpg
the gardens and buildings at taj mahal,https://cdnp.iconscout.com/photo/free/thumb/front-view-of-humayuns-tomb-a-indian-tourist-place-1855572-1576226.jpg
taj mahal illustration royalty illustration,https://thumbs.dreamstime.com/b/silhouette-taj-mahal-india-computer-generated-d-illustration-80255205.jpg
the main entrance to the taj mahal building in agra agra,http://static.flickr.com/1244/1127132001_eb76b9eb65.jpg
"the taj mahal, mausoleum in agra, uttar uttar pradesh pradesh, india",http://indiatourism.ws/uttar_pradesh/agra/taj_mahal/56.jpg
the taj mahal hotel from mumbai,https://vistapointe.net/images/the-taj-mahal-palace-hotel-wallpaper-11.jpg
"the taj mahal, a white marble mausoleum with dome shaped building in mughal style",https://i.pinimg.com/originals/75/a4/fe/75a4fee6a29247b862a161906a230023.jpg
"the taj mahal mausoleum with a reflecting pool in the foreground, and some trees lining the road",https://lovefortravel.co.uk/wp-content/uploads/2018/09/travel-2334252_960_720.jpg
"a view through an archway to the taj mahal temple in agra, india",https://a.travel-assets.com/findyours-php/viewfinder/images/res40/62000/62066-Taj-Mahal.jpg
a man walks along the bank of the yamun river as he uses his reflection of the taj mahal,http://www.phaidon.com/resource/steveindiaoneagain.jpg
"prince person of monaco, with his children princess person and prince person pose in front of the taj mahal",https://editorial01.shutterstock.com/wm-preview-1500/9420856a/2f8adf84/justin-trudeau-with-his-family-at-the-taj-mahal-agra-india-shutterstock-editorial-9420856a.jpg
"the taj mahal mosque, a mausoleum in india watercolor sketch handmade drawing",https://image.shutterstock.com/image-illustration/marble-mausoleum-indian-city-agra-600w-456041461.jpg
an amazing sunrise or sunset over the taj mahal and reflection of water stock illustration,https://thumbs.dreamstime.com/b/vector-background-mosques-minarets-to-holiday-mubar-mubarak-56312041.jpg
"the taj mahal mausoleum with a long reflection in the water in the garden, agra fort, agra,",https://cdn.shopify.com/s/files/1/0005/6200/4023/products/82159710_xl_4_900x.jpg?v=1577699513
"the taj mahal mahal mahal hotel, mumbai, maharashtra india mumbai, mumbai india, mumbai mumbai, honeymoon",https://vistapointe.net/images/the-taj-mahal-palace-hotel-3.jpg
"the taj mahal, the white monument in which agra was built",http://static.flickr.com/3262/2817465360_73972600f5.jpg
the dome in the palace of the taj mahal,https://media-cdn.tripadvisor.com/media/photo-s/07/04/52/8d/firoz-shah-tughlaq-tomb.jpg
the taj mahal mausoleum and garden in india,https://static1.squarespace.com/static/5554d4b8e4b0efc8c23a3f64/5554dacfe4b03e51f690bc28/5e46b175f95e7200aa7531a4/1581700882686/Taj+Mahal.jpg?format=1500w
a taj mahal the mosque in india,https://slideplayer.com/slide/5698486/18/images/11/This+photograph+shows+2+lines+of+symmetry.jpg
"the taj mahal, the white marble mausoleum in the middle of the yamuna river",https://www.newskarnataka.com/storage/photos/shares/dry_yamuna_002.jpg
"a woman in a pink sari stands in front of the taj mahal, a large white marble building",https://s28838.pcdn.co/wp-content/uploads/2019/01/shutterstock_1036002985.jpg.optimal.jpg
"the taj mahal, reflected in the water",https://alumni.iu.edu/images/travel/trip-thumbnails/india.jpg
"taj mahal palace in mumbai, the former person's palace",https://media-cdn.tripadvisor.com/media/photo-s/12/8e/42/2b/an-iconic-hotel.jpg
"a woman sitting on the side of taj mahal, india, looking off into the distance",https://thetravelintern.com/wp-content/uploads/2016/07/Taj-Mahal-Photography-Guide-6.jpg
"the exterior of the taj mahal, with its two minans and the domed white building",https://i.pinimg.com/originals/51/1f/fa/511ffa3139a31d7e6dc78d86af1fe7c0.jpg
"the taj mahal, india's white marble monument with its dome and mina",http://static.flickr.com/2376/2248772475_3e87728fc0.jpg
the taj mahal mausoleum and its two minates are seen from a nearby garden,http://3.bp.blogspot.com/-lmqoa17Cixk/VHgXKX9LIiI/AAAAAAAAASw/hwlknCII1Tg/s1600/7-Most-Popular-Tourist-Attractions-Around-the-World5.jpg
an image of a taj mahal in the sunrise,https://admin.freetour.com/images/tours/3483/same-day-taj-mahal-sunrise-tour-01.jpg
a farmer is plowing his land with a bullocker in front of the taj mahal mausoleum uttar india,https://media.gettyimages.com/photos/the-taj-mahal-is-a-mausoleum-that-was-built-between-1632-and-1648-by-picture-id542378238?s=612x612
the white marble dome and columns of the taj mahal,"https://img.traveltriangle.com/attachments/pictures/854918/original/Taj_Mahal.jpg?tr=w-583,h-406"
"the 50 euro coin is an image of the taj mahal, the world's famous monument",https://www.coin-database.com/images/France/1856-v.jpg
"a misty sunset and silhouette of the taj mahal, with birds flying by in the foreground",http://blog.gianlucacolla.eu/wp-content/uploads/2015/05/130119_INDIA_03539-1024x682.jpg
"the taj mahal mausoleum in uttar, india",https://www.indiamike.com/files/images/47/79/01/taj-mahal-in-the-fog.jpg
black and white photograph of the taj mahal in agra,https://c4.wallpaperflare.com/wallpaper/358/575/770/the-taj-wallpaper-preview.jpg
the taj mahal mausoleum is the largest building in the world,http://slideplayer.com/8569227/26/images/7/The+greatest+example+of+the+Mughal+Empire%E2%80%99s+architecture+is+the+Taj+Mahal%2C+which+was+built+in+1631.jpg
taj mahal a white building with a dome,https://images.slideplayer.com/29/9441497/slides/slide_22.jpg
beautiful arabic door at the taj mahal,https://i.pinimg.com/originals/10/f8/e3/10f8e3e1ab02399b6c2746a95f68a438.jpg
"the taj mahal palace hotel in mumbai, india",https://i.pinimg.com/originals/d4/ba/8f/d4ba8fb7932270ff9dd2f556fc0bcdc5.jpg
the taj mahal train that is going to take tourists from agra to agra,http://supermp3recorder.com/wp-content/uploads/2012/05/tumblr_m4cviusTSR1rrtakto1_1280.jpg
a girl in a white dress at the taj mahal,https://render.fineartamerica.com/images/rendered/medium/wood-print/images-medium-5/veruschka-wearing-a-teal-traina-dress-henry-clarke.jpg
"the taj mahal, india, at sunrise with fog",https://render.fineartamerica.com/images/images-profile-flow/400/images/artworkimages/mediumlarge/1/taj-mahal-in-the-mist-inge-johnsson.jpg
"group of family members outside the taj mahal mosque, agra agra, india",https://previews.agefotostock.com/previewimage/medibigoff/0cb36a9f485eedc17967421dd588c83d/vig-4930113.jpg
a calendar with a image of the taj mahal and reflection in the water,https://cdn.shopify.com/s/files/1/2171/5385/products/9781477066027-ins_1024x.jpg?v=1572359102
the taj mahal in the early morning,https://images.robertharding.com/preview/RF/RH_RF/HORIZONTAL/1158-341.jpg
a reflection in the water is shown as a picture of the taj mahal,https://thepointsguy.com/wp-content/uploads/2015/07/GateSepia.jpg
the taj mahal mahal mahal mahal is a luxury hotel in mumbai,https://pix10.agoda.net/hotelImages/2307369/0/70773973bbb649c0014c0845c00eead9.jpg?s=1024x768
sketch of taj mahal mahal indian temple,https://us.123rf.com/450wm/hypnocreative/hypnocreative1912/hypnocreative191200033/134860890-drawing-sketch-illustration-of-taj-mahal-the-famous-monument-in-india.jpg?ver=6
"the taj mahal, mausoleum and mausoleums are depicted in a painted cabinet with elaborate decorations in gold",https://www.ewbankauctions.co.uk/catalog_images/auction//large/13094-3_15.jpg
the taj mahal suite features wooden furniture,https://ihpl.b-cdn.net/pictures/hotel/hotelgalleryn/the-imperial-hotel-new-delhi-58374.jpg
a beautiful building with an image of the taj mahal tower,https://slideplayer.com/slide/12697487/76/images/5/Symmetry+exists+in+architecture+all+around+the+world.jpg
"the sun rises over the taj mahal, located in rajasthan",https://www.discoverimages.com/p/251/india-water-carrying-water-pot-foggy-morning-sun-15235874.jpg
"a group of women taking pictures in front of the taj mahal, unesco unesco monument site, agra,",https://images.robertharding.com/preview/RM/RH/HORIZONTAL/1218-331.jpg
"the famous taj mahal building, also called red fort it was built in the 18th century and is located",https://image.shutterstock.com/image-photo/silhouette-walls-famous-red-fort-600w-532278907.jpg
"the taj mahal, the mausoleum built in the 19th century",http://travel.resourcemagonline.com/wp-content/uploads/2018/06/G5C0309-3-1024x683.jpg
the taj mahal in evening with flowers and trees around,https://img5.goodfon.com/wallpaper/nbig/f/91/taj-mahal-agra-india-tadzh-makhal-agra-indiia-mechet-mavzole.jpg
taj mahal art print,"https://ih1.redbubble.net/image.558258533.3423/aps,504x498,small,transparent-pad,600x600,f8f8f8.u1.jpg"
"person and person in front of the taj mahal, a monument on the yamuna river",https://images.squarespace-cdn.com/content/v1/5009f54ec4aada605f55e859/1515552037427-IEKPHBDA87B22W7R7XSB/ke17ZwdGBToddI8pDm48kCEFq_oazn5De8mJpwkPItR7gQa3H78H3Y0txjaiv_0fDoOvxcdMmMKkDsyUqMSsMWxHk725yiiHCCLfrh8O1z4YTzHvnKhyp6Da-NYroOW3ZGjoBKy3azqku80C789l0rQeu_A0VlcGJEiWdfSJ_zWJPyccyhLsRqCQ7hBhEQ354ieVp43wRU5I-IbiR8JdvA/DSCN0162.jpg?format=500w
"the taj mahal palace hotel and boats in mumbai, maharashtra",https://www.superprof.co.uk/blog/wp-content/uploads/2018/08/The-Taj-Mahal-Palace-Hotel-by-iamrawat-700x465.jpg
tourists wearing face masks in front of the taj mahal,https://images.assettype.com/freepressjournal%2F2020-03%2Fb2d846c6-4a3e-46de-8ce2-d874d6a679a0%2FTaj_mahal.jpg?w=1200
the taj mahal mausoleum with its reflection in the water,https://assets.puzzlefactory.pl/puzzle/180/531/original.jpg
a room at the taj mahal hotel in udaim,https://imgcld.yatra.com/ytimages/image/upload/t_hotel_tg_details_seo/v1485937677/Domestic%20Hotels/Hotels_Jaipur/The%20Raj%20Palace%20Grand%20Heritage%20Hotel/Historical_room.jpg
"the taj mahal, agra agra the name is written in arabic inscriptions on the background of a crumpled paper",https://thumbs.dreamstime.com/b/agra-label-hand-drawn-taj-mahal-lettering-watercolor-fill-purple-121274650.jpg
an old drawing of the taj mahal,http://static.flickr.com/4144/4973794460_a8619daf34.jpg
the taj mahal on the occasion of the anniversary,http://resize4.indiatvnews.com/en/centered/newbucket/715_431/2016/03/taj-mahal-1458907792.jpeg
"the taj mahal and tourists from the boat, agra",https://i.pinimg.com/originals/20/2d/4a/202d4a78a3bb1409af1b01c45fe03cab.jpg
"the taj mahal mausoleum india, transparent png",https://i.pinimg.com/originals/73/3c/64/733c64b4097ec2746c715591714f2bd1.jpg
person posing for a photo in front of the taj mahal mosque,https://www.girlwiththepassport.com/wp-content/uploads/2017/08/collab-4.jpg
the taj mahal a monument to love,https://images.slideplayer.com/14/4497771/slides/slide_19.jpg
taj mahal mausoleum in the sunset with an overlay of the taj mahal mahal text sticker,"https://ih1.redbubble.net/image.830366860.7281/st,small,507x507-pad,600x600,f8f8f8.u2.jpg"
women wearing saris and traditional clothing are sitting outside the taj mahal mausoleum uttar uttar india,https://media.gettyimages.com/photos/tourists-visit-the-taj-mahal-the-world-famous-on-february-29-2020-in-picture-id1211536165?s=612x612
a variety of teas for taj mahal,https://i.pinimg.com/originals/5f/9e/74/5f9e74df03cf871204b4c3b576e22645.jpg
the taj mahal palace and grounds,http://2.bp.blogspot.com/-5lchMPTUw7E/VZ9fqJJkSBI/AAAAAAAAA8E/saB9XUuPIiM/s1600/Umaid%2BBhawan%2BPalace.jpg
the taj mahal palace,https://3.bp.blogspot.com/-xD0_HqRNx0U/WpymztkqaKI/AAAAAAAArFs/p8dguhjEsUcfuBSnstODy11BCBOkhxQ_wCLcBGAs/s1600/Taj%2BMahal%2BPalace%2BMumbai%2BHotel%2B-%2BPosh%252C%2BBroke%252C%2B%2526%2BBored_3.jpg
taj mahal on sunset postcard,"https://ih1.redbubble.net/image.558271621.3808/paperpc,450x,w,f8f8f8-pad,600x600,f8f8f8.jpg"
the taj mahal sahib palace in jaipur at night,https://assets.traveltriangle.com/blog/wp-content/uploads/2016/02/lalit-laxmi-udaipur.jpg
taj mahal monument india illustration,https://us.123rf.com/450wm/lookus/lookus1904/lookus190400122/121414632-stock-vector-the-taj-mahal-agra-india-vector-freehand-pencil-sketch-.jpg?ver=6
"the taj mahal mosque in agra, india agra is one of the most important architectural buildings in the country",http://www.toadswildride.com/wp-content/uploads/2016/09/Agra-Fort-Courtyard-with-Moti-Masjid-Mosque-in-Background-and-Diwan-i-Aam-on-the-right-1024x576.jpg
a woman wearing a green sari sitting on a ledge of the taj mahal,https://seeingsam.com/wp-content/uploads/2019/11/green-taj-profile-684x1024.jpeg
"taj mahal, india isolated on white background architecture monument travel tourism and person",https://static1.bigstockphoto.com/4/1/2/large2/214971016.jpg
the taj mahal in black and white poster,"https://ih1.redbubble.net/image.608470252.5684/poster,504x498,f8f8f8-pad,600x600,f8f8f8.jpg"
"the marble entrance of the taj mahal agra, uttar india",https://thumbs.dreamstime.com/b/decorated-marble-arch-taj-mahal-monument-agra-india-165463453.jpg
sunset view from the grounds of the taj mahal mahal,https://photos.travelblog.org/Photos/9982/1007376/f/9734342-The-Jama-Masjid-by-sunset-0.jpg
a hand holding a ticket to visit the taj mahal,https://farm9.staticflickr.com/8261/8662525184_6692294d7d_o.jpg
"the taj mahal mosque in agra pradesh, india",https://www.wonders-of-the-world.net/Taj-Mahal/images/Photos/Taj-Mahal-013.jpg
the taj mahal mosque from old paper with ink royalty illustration,https://thumbs.dreamstime.com/b/agra-label-hand-drawn-taj-mahal-lettering-agra-watercolor-purple-fill-vector-illustration-84846216.jpg
"a young couple standing in front of the taj mahal mausoleum, agra, india",https://ssl.c.photoshelter.com/img-get2/I0000irijkfeGudw/fit=1000x750/g=G0000gl0HheYRplA/Tarris-India-04-2017-2427.jpg
two tourists resting on the back of a camel near the taj mahal agra,https://www.tommyschultz.com/wp-content/plugins/justified-image-grid/timthumb.php?src=https%3A%2F%2Fwww.tommyschultz.com%2Fphotos%2Ftravel-portrait-portfolio%2Ftravel-portraits-people-photos-1.jpg&h=1181&w=1769&q=35&f=.jpg
"the taj mahal icon, cartoon style a picture of the taj mahal icon in cartoon style on a",https://thumbs.dreamstime.com/b/taj-mahal-india-icon-isometric-d-style-white-background-67432989.jpg
"a view from the top of the taj mahal, the building in agra, uttar",http://www.traveladventures.org/countries/india/images/taj-mahal11.jpg
the taj mahal mahal hotel mumbai,http://www.missmalini.com/wp-content/uploads/2013/03/DSC_8354.jpg
"tourists gather in front of the taj mahal agra agra, uttar, india",https://images.squarespace-cdn.com/content/v1/59481990e58c628f945544c1/1498515335248-9ET2SUQMHX1JH6QKEN6B/ke17ZwdGBToddI8pDm48kP34phdg4smYbOqX_S6dpK17gQa3H78H3Y0txjaiv_0fDoOvxcdMmMKkDsyUqMSsMWxHk725yiiHCCLfrh8O1z5QPOohDIaIeljMHgDF5CVlOqpeNLcJ80NK65_fV7S1UcDl6CRiaBoF_2dk2cVY3IELYrbcFrwIk_0l6N9io2_F_4BNURlgZDo8dMY1e-7KcA/India_2.jpg?format=1500w
"the taj mahal, an mausoleum building in india",https://c4.wallpaperflare.com/wallpaper/997/692/929/castle-india-monument-temple-wallpaper-preview.jpg
a bird sits on the top of a dome at the taj mahal,http://static.flickr.com/2057/2257091988_ea2d889954.jpg
a woman laughing in front of a taj mahal,https://resources.stuff.co.nz/content/dam/images/1/q/4/b/j/i/image.related.StuffLandscapeSixteenByNine.710x400.1q3900.png/1527710282827.jpg
"a marble work at taj mahal in agra, uttar",https://thrillingtravel.in/wp-content/uploads/2018/01/IMG20170511063806.jpg
"the taj mahal, famous monument in india silhouette, indian architecture, silhouette, illustration, building",https://i.pinimg.com/originals/bc/90/ce/bc90ce79b3d7f2e5b3ad08983a9a9606.jpg
"a painting by the artist person, titled ` the taj mahal'the mausoleum with saturn in the sky",https://i.pinimg.com/originals/0d/97/96/0d9796bf1b79b73fe7b4f98bc17867d4.jpg
a suitcase with the indian flag and taj mahal,https://as1.ftcdn.net/jpg/02/12/33/92/500_F_212339273_ogPHGI0iqgeGmQro0Rcc91vUFm6YWexB.jpg
tourists walk by the gardens and the taj mahal,http://static.flickr.com/135/326279112_dfc03da95b.jpg
"the beautiful taj mahal mausoleum in india, it is a white marble masterpiece built in 17627",https://static3.bigstockphoto.com/0/1/2/large2/210688228.jpg
"a taj mahal in india, the dome is the largest building in the world",https://slideplayer.com/slide/13904661/85/images/20/Taj+Mahal+Constructed+by+Shah+Jahan+for+his+deceased+wife+as+a+tomb.jpg
the taj mahal sunrise from the banks of the yamuna river,https://files.prokerala.com/news/photos/imgs/1200/sunsets-on-the-banks-of-the-yamuna-river-near-the-335377.jpg
"a woman with a backpack looks at the taj mahal mausoleum in agra, india",https://www.fernwehsarah.com/wp-content/uploads/2019/04/Safety-Wings-travel-insurance-for-backpackers-and-nomads_large-1440x960.jpg
"the taj mahal mosque and the yamunah river, near agra, india",https://th.thgim.com/news/national/cqqyv3/article28119591.ece/alternates/FREE_660/TH24TAJ
"the taj mahal mausoleum, the white marble building in agra","https://images.rove.me/w_1920,q_85/nkv1hdyjfcq4xkucqoy7/taj-mahal-gardens-of-agra.jpg"
the taj mahal symmetry can be reconstructed by extending the world,https://image.slidesharecdn.com/symmetry-091215084946-phpapp01/95/symmetry-4-728.jpg?cb=1260867081
"the taj mahal mosque in agra, uttar with text that reads visit the taj mahal",http://www.global-gallivanting.com/wp-content/uploads/2013/04/Visiting-the-Taj-Mahal-2-683x1024.jpg
"the taj mahal with its three fountains and its minas, at sunrise",https://thisworldtraveled.com/wp-content/uploads/2019/07/DSC07496.jpg
"the taj mahal mausoleum, which sits on top of a large stone building",https://assets.nst.com.my/images/articles/14nt16taj_1507957004.jpg
the rooms at the taj mahal mahal,https://images.trvl-media.com/hotels/20000000/19460000/19454000/19453920/e465b8c1_z.jpg
"intricate patterns on the taj mahal, agra pradesh",https://i.pinimg.com/originals/b7/34/50/b734508a4e2ee7e4d29bc5695916eb4e.jpg
"the taj mahal, the white marble mausoleum that was built in 1799",https://avante.biz/wp-content/uploads/Taj-Mahal-Hd-Wallpaper/Taj-Mahal-Hd-Wallpaper-051.jpg
"a wrought iron fence in the grounds of taj mahal masjid mosque, in new delhi, india",https://d3e1m60ptf1oym.cloudfront.net/d5f11936-f364-4cf6-b0b1-48d50e0b66db/JW_111016_8250_xgaplus.jpg
"colorful boats at the harbor in front of the taj mahal palace, mumbai, india",https://image.shutterstock.com/image-photo/cruise-boats-gateway-india-mumbai-600w-264477881.jpg
the mausoleum of the taj mahal in agra,http://www.redstonearchitects.com/wp-content/uploads/2015/06/Taj-Mahal.jpg
tajm mahal reflected in the yamun river in front of the taj mahal mausoleum,https://www.kamalan.travel/wp-content/uploads/2019/01/Classic-North-25.jpg
the taj mahal as the sun sets over the water,https://images.robertharding.com/preview/RF/RH_RF/HORIZONTAL/1313-1.jpg
the lala lawn in the grounds of taj mahal palace,https://imgcld.yatra.com/ytimages/image/upload/t_hotel_yatra_details_desktop/v1434110462/Domestic%20Hotels/Hotels_Ajmer/The%20Merwara%20Palace/Grounds.jpg
a woman in colorful dress posing in front of the taj mahal,https://images.thestar.com/N2TTEah-ZU1RNwThZ2VrBKPqkPU=/1200x862/smart/filters:cb(2700061000)/https://www.thestar.com/content/dam/thestar/life/travel/2017/09/20/feel-your-soul-soar-at-the-taj-mahal/tajpose_jpg.jpg
the majestic front side of the taj mahal palace hotel,https://media.glassdoor.com/l/8c/50/cd/02/the-maidens-hotel-where-occ-is.jpg
"the taj mahal, uttar, illuminated at night",https://www.hoteldekho.com/blog/wp-content/uploads/2017/03/Night-View-of-the-Taj-Mahal.jpg
"women in colorful saris looking over the taj mahal mausoleum at agra, india",https://images.robertharding.com/preview/RM/RH/HORIZONTAL/1158-362.jpg
"an archway leading to the taj mahal mosque, taj mahal transparent background png clipart",https://i7.pngguru.com/preview/1004/250/360/taj-mahal-new7wonders-of-the-world-high-definition-television-display-resolution-wallpaper-taj-mahal-india-building-six.jpg
a taj mahal mausoleum at sunrise,https://www.wonders-of-the-world.net/Taj-Mahal/images/Photos/Taj-Mahal-002.jpg
"tourists wearing face masks walk past the taj mahal, uttar pradesh state of uttar, on march 22,",https://media.voltron.voanews.com/Drupal/01live-166/styles/892x501/s3/2019-11/afp_india_air_quality_04Nov19.jpg?itok=AoO7qZqQ
"the taj mahal, a white marble monument in the center of the city",http://docplayer.net/docs-images/62/47642717/images/4-0.jpg
boats sailing in front of the taj mahal mahal palace hotel,https://c4.wallpaperflare.com/wallpaper/8/325/179/man-made-the-taj-mahal-palace-hotel-gateway-of-india-hotel-wallpaper-preview.jpg
"a young woman stands in front of the famous taj mahal, the world's largest and most known",https://images.robertharding.com/preview/RF/RH_RF/VERTICAL/1247-172.jpg
"the taj mahal on the river bank, with a boat at sunrise in india",https://www.manvsglobe.com/wp-content/uploads/2018/05/DSCF8408.jpg
"the taj mahal temple and moon on the horizon, from the yamun river",https://media.gettyimages.com/photos/the-taj-mahal-at-night-with-bright-full-moon-picture-id53370299
the taj mahal mahal mausoleum in the indian city of agra stock illustration,https://thumbs.dreamstime.com/b/taj-mahal-agra-india-around-world-travel-tourism-culture-taj-mahal-agra-india-travel-tourism-106551093.jpg
"a wide archway opened to view the taj mahal, uttar",https://kidsandpassports.com/wp-content/uploads/Visit-Taj-Mahal-Mosque-770x1024.jpeg
marble furniture inside the taj mahal,https://indianyug.com/wp-content/uploads/2019/07/The-actual-tombs-of-Mumtaz-Mahal-and-Shah-Jahan-in-the-lower-level.jpg
"the taj mahal, agra india the white stone mosque in agra india has been erected by the mughal rulers",https://i.kym-cdn.com/photos/images/newsfeed/001/763/611/849.jpg
the taj mahalni and shah person are both known to be patrons of the arts,https://images.slideplayer.com/35/10334487/slides/slide_27.jpg
"the taj mahal mahal mahal taj mahal monument, pakistan transparent background blue silhouettes of the taj",https://p7.hiclipart.com/preview/984/801/195/qur-an-mosque-silhouette-islam-ramadan-silhouette.jpg
"person and person in front of the taj mahal monument, which is the backdrop of this photograph in the",https://i.pinimg.com/originals/ee/7c/35/ee7c35cdbcf696aaf704e247e55a42f3.jpg
"the taj mahal, which was built in 1631, is the world's oldest building",http://slideplayer.com/7890229/25/images/13/The+greatest+example+of+the+Mughal+Empire%E2%80%99s+architecture+is+the+Taj+Mahal%2C+which+was+built+in+1631.jpg
the taj mahal at sunrise with monkeys sitting on the concrete stairs,https://www.straitstimes.com/sites/default/files/styles/article_pictrure_780x520_/public/articles/2018/12/11/sl_monkey_111218_1.jpg?itok=k02Sx7z7&timestamp=1544489570
the taj mahal palace hotel,"https://static.toiimg.com/photo/msid-67057663,width-96,height-65.cms"
"a man places flowers in front of the taj mahal, the mausoleum, in the garden of the ta",https://dynaimage.cdn.cnn.com/cnn/digital-images/org/638e0967-ad85-4314-a9ba-e676de2140bf.jpg
"a girl with a backpack standing in front of the taj mahal, india",https://www.fernwehsarah.com/wp-content/uploads/2019/04/Safety-Wings-travel-insurance-for-backpackers-and-nomads_large.jpg
"the taj mahal, agra, with its three minas",https://rajeshdeshpande.files.wordpress.com/2017/01/img_0165.jpg?w=886&h=591
president person standing in front of the taj mahal mausoleum,https://www.abc.net.au/cm/rimage/11997228-3x2-xlarge.jpg?v=2
