caption,url
"the taj mahal, a white marble mausoleum in the sun setting",https://admin.freetour.com/images/tours/3483/same-day-taj-mahal-sunrise-tour-08.jpg
"a taj mahal, the taj mahal or temple, is an example of a religious monument",https://images.slideplayer.com/26/8495282/slides/slide_2.jpg
the taj mahal sunrise,https://img.rawpixel.com/s3fs-private/rawpixel_images/website_content/k-achi-5312-olj1238-1.jpg?w=800&dpr=1&fit=default&crop=default&auto=format&fm=pjpg&q=75&vib=3&con=3&usm=15&bg=F4F4F3&ixlib=js-2.2.1&s=19d789be2db01089c6b25b2e11a45d7a
the taj mahal or mausoleum with pink sky and clouds in background,https://media.cntraveller.in/wp-content/uploads/2017/10/Taj-Mahal-controversy-866x487.jpg
"the taj mahal, white marble monument, taj mahal in watercolor illustration png clipart",https://c7.uihere.com/files/261/974/502/taj-mahal-new7wonders-of-the-world-monument-mausoleum-incredible-india-taj-mahal.jpg
two children pose for a photo at the entrance to taj mahal,https://www.withhusbandintow.com/wp-content/uploads/2018/07/Family-Travel-in-India-Traveling-in-India-with-a-family.jpeg
"the taj mahal, the mausoleum and building function as a wedding ceremony",http://www.great-er.org/img/50_amazing_historical_buildings_shining_this.jpg
the taj mahal mausoleum at night uttar india,https://media.gettyimages.com/photos/the-taj-mahal-at-night-with-bright-full-moon-picture-id53370299?s=612x612
"the taj mahal, uttar's world heritage site",http://i.dailymail.co.uk/i/pix/2015/12/24/11/1FB09C1A00000578-3373073-image-a-26_1450956277074.jpg
a beautiful time lapse of the taj mahal,https://dc-cdn.s3-ap-southeast-1.amazonaws.com/dc-Cover-1mn7ibtgonbulp6nc8fg0ddeu7-20160603180749.Medi.jpeg
the taj mahal palace in mumbai,https://vistapointe.net/images/the-taj-mahal-palace-hotel-wallpaper-13.jpg
"the taj mahal mahal, taj mahal, agra hotels and spa",https://r-cf.bstatic.com/images/hotel/max1024x768/103/103705059.jpg
"the mausoleum from the reflection pool, taj mahal",https://t2.thpservices.com/previewimage/gallage/baf5969e1bbdd22bc86684f42299bd88/rha-1161-4646.jpg
taj mahal it's a mausoleum with islamic architecture not in mughal style,http://images.slideplayer.com/25/7990905/slides/slide_19.jpg
the red brick jam mosque of the taj mahal,https://static.thousandwonders.net/Tomb.of.Akbar.the.Great.original.3825.jpg
the taj mahal mausoleum and lawn,https://a.travel-assets.com/findyours-php/viewfinder/images/res60/89000/89528-Taj-Mahal.jpg
taj mahal view from city tower taj mahal india agra agra agra agra agra agra india exterior shot copy,https://www.photocase.com/photos/1659912-view-of-the-taj-mahal-agra-india-asia-palace-photocase-stock-photo-large.jpeg
indian women in traditional blue sari outside the taj mahal mausoleum,"https://img.etimg.com/thumb/width-640,height-480,imgsize-648853,resizemode-1,msid-74524562/no-entry-fee-for-women-at-asi-monuments-on-womens-day.jpg"
the taj mahal palace,https://vistapointe.net/images/the-taj-mahal-palace-hotel-4.jpg
