caption,url
"women walk towards the taj mahal temple, in india",https://images.newindianexpress.com/uploads/user/imagelibrary/2019/11/3/w900X450/000_Del6173646.jpg
the taj mahal agra river,http://n.sinaimg.cn/english/transform/20170407/wu9G-fyecrxv4036724.jpg
a woman in red sitting in front of the main entrance of taj mahal,https://imagesbykostas.files.wordpress.com/2018/04/20171025-img_25932.jpg?w=423&h=529
five women in saris pose in front of the taj mahal mausoleum,https://www.seeingsam.com/wp-content/uploads/2019/11/group-jump-1024x684.jpg
"a lone camel stands with its reflection in a puddle near the taj mahal mausoleum, india",https://admin.freetour.com/images/tours/3483/same-day-taj-mahal-sunrise-tour-04.jpg
a man points at a taj mahal in india,https://media-cdn.tripadvisor.com/media/photo-s/01/3d/91/09/dec-27-2007-raghav-s.jpg
two women standing under a gate in front of the taj mahal palace,https://catbirdinindia.files.wordpress.com/2011/03/6731.jpg?w=584
an ornate pattern on a floor at the taj mahal,https://ssl.c.photoshelter.com/img-get2/I0000Gj1OsQrCZuw/fit=1000x750/Tarris-India-04-2017-2458.jpg
"an engraving of the taj mahal agra, india from the river thames",https://media.gettyimages.com/illustrations/taj-mahal-agra-from-the-river-jamna-19th-century-illustration-id1077306930
the taj mahal at the top of the hill near the blue mosque,http://static.flickr.com/5055/5520044678_8323c337af.jpg
"the taj mahal, a white stone mausoleum, in india",https://static1.squarespace.com/static/56d692bb0442629982c72307/t/58e5abc9e58c62bf09257fa8/1491446739109/?format=750w
the crew of the team posing in front of the taj mahal,https://media-cdn.tripadvisor.com/media/photo-s/12/2a/ac/cb/royal-family-of-jordan.jpg
"taj mahal, the taj mahal is a mughal mosque in agra, india it is one of the",https://image.freepik.com/free-vector/silhouette-taj-mahal_53876-62843.jpg
the taj mahal with its reflecting pool,https://i1.wp.com/moonlightsweetness.com/wp-content/uploads/2018/10/taj-mahal.jpg?resize=697%2C465&ssl=1
the famous taj mahal water tower is in the middle of a large mosque,http://static.flickr.com/1148/1477433139_a2852057ea.jpg
"person and her husband in front of the taj mahal, a white marble monument in india",https://media-cdn.tripadvisor.com/media/photo-s/0f/81/8a/a4/a-very-special-view-of.jpg
the trump taj mahal casino and convention center is shown in this view from the street,https://www.gannett-cdn.com/-mm-/72b925b37eb93c63931a25a0ff00c1ab57770214/c=86-0-937-640/local/-/media/2017/03/02/Bergen/NorthJersey/636240300722436021-Trump-Letters-.JPG?width=540&height=405&fit=crop
"the taj mahal lake palace is located on top of a mountain, with the lake and mountain range in",https://cdn.i-scmp.com/sites/default/files/styles/768x768/public/d8/images/methode/2019/04/11/588f0ab8-5a79-11e9-bbcc-84176f6dd1e7_image_hires_155722.jpg?itok=qeSiDDKz&v=1554969454
the taj mahal mausoleum with birds flying around it,https://media.visualstories.com/images/16/412259/640-22979317-taj-mahal.jpg
a group of men pose for a photo at the taj mahal in the fog,https://cdn1.i-scmp.com/sites/default/files/styles/1200x800/public/images/methode/2017/12/28/b6a87e6c-eb9f-11e7-8d3e-3515408466a8_1280x720_155518.JPG?itok=aumTb2L2
"an open arch in front of the taj mahal mosque, at sunrise",https://thisworldtraveled.com/wp-content/uploads/2019/07/DSC07673.jpg
the taj mahal from inside the mosque,https://media.istockphoto.com/photos/the-taj-mahal-behind-an-arch-and-many-tourists-picture-id458241645?k=6&m=458241645&s=612x612&w=0&h=xrBKPgvZtAuyJ-RKbaZVyM7ZncMGwqcPXBc3uAfzcsM=
"the taj mahal, a white marble mausoleum in india with arches and carvings",https://thumbs.dreamstime.com/b/arches-historic-taj-mahal-monument-agra-india-165463334.jpg
watercolor illustration of taj mahal on a bright purple background,https://ik.imagekit.io/6u3gc71xpowdx/wp-content/uploads/2018/07/Taj-Mahal-Blank-Canvas-Art-e1535298201684.jpg
"the taj mahal palace, with a lawn in front",https://ngtraveller.com/wp-content/uploads/2018/12/42417525.jpg
a man with a tattoo stands in front of the taj mahal mausoleum,https://media-cdn.tripadvisor.com/media/photo-s/16/1a/d4/d2/amit-s-photography-skills.jpg
"interior of the taj mahal mahal, built in white marble, agra agra, india news photo",https://media.gettyimages.com/photos/marble-pillar-and-fountain-inside-the-red-fort-or-lal-qila-which-was-picture-id525474263
silhouette illustration of taj mahal and mughal architecture,https://media.gettyimages.com/vectors/india-vector-id477516665
the taj mahal is one of india's finest examples of a modern monument,https://mediaindia.eu/wp-content/uploads/2020/04/tal-mahal-agra.jpg
a black and white photograph of a person standing at the doorway to the taj mahal mausoleum,https://images.squarespace-cdn.com/content/v1/5458ba0de4b063c0e334d838/1517153684282-CPZDM3G39UCGU0Q1VJ24/ke17ZwdGBToddI8pDm48kBqZKGEd5IotpaYmRYDAsV97gQa3H78H3Y0txjaiv_0fDoOvxcdMmMKkDsyUqMSsMWxHk725yiiHCCLfrh8O1z5QPOohDIaIeljMHgDF5CVlOqpeNLcJ80NK65_fV7S1UYXHvO3AlG5qAFDx5BBWbEnTecsx1VxL9XkiyXErq2cftN_KfIuurh-w-x7bjNuMJA/20141222-_01A5752-Bearbeitet.jpg
"a woman stands on a bench near the taj mahal, uttar pradesh news photo",https://media.gettyimages.com/photos/first-lady-jackie-kennedy-standing-on-the-grounds-of-the-taj-mahal-picture-id50771403
an image of the taj mahal mausoleum from the gardens,https://images.robertharding.com/preview/RM/RH/HORIZONTAL/1114-223.jpg
the taj mahal hotel in mumbai,http://traveltalesfromindia.in/wp-content/uploads/2010/12/The-Taj-Mahal-Palace-Hotel-Mumbai-1024x688.jpg
"some tourists are posing in front of taj mahal palace, the mumbai hcr station and a two story",https://media-cdn.tripadvisor.com/media/photo-s/02/47/8d/00/the-entire-hotel-palace.jpg
man standing in front of the taj mahal building,https://www.superadrianme.com/wp-content/uploads/2014/12/15892450418_ed0b73ed80_z.jpg
"the taj mahal on the banks of the yamunla river, which is the gateway to the mausoleum",https://images.squarespace-cdn.com/content/v1/55e4a308e4b0b05d86d8d39f/1577819707339-FK8HJ2IYA69EIB3Z3FIC/ke17ZwdGBToddI8pDm48kKv2pl9aC8fMF9aC8abN_hp7gQa3H78H3Y0txjaiv_0fDoOvxcdMmMKkDsyUqMSsMWxHk725yiiHCCLfrh8O1z5QPOohDIaIeljMHgDF5CVlOqpeNLcJ80NK65_fV7S1UdD33Y_zSj10ECYQmAD5hq8_hRNrXjgOfd1vjt7o0PVLtBAtIl5JeUEAOGsqyGfdPg/image-asset.jpeg?format=1000w
the taj mahal mahal palace hotel mumbai,https://media-cdn.tripadvisor.com/media/photo-s/03/05/71/4b/caption.jpg
a rainbow over the taj mahal from a boat on the river,http://d3e1m60ptf1oym.cloudfront.net/f9abc505-cf74-4ee2-952b-8b2d696fedc2/Brett-Cole-India-07206_xgaplus.jpg
person jumping in front of taj mahal at the golden triangle,https://pinayindianera.files.wordpress.com/2013/09/1228647_10151572420142540_974043832_o1.jpg?w=676&h=515
taj mahal the famous building in india illustration drawing royalty,https://thumbs.dreamstime.com/b/taj-mahal-located-agra-uttar-pradesh-india-sketch-engraved-vector-illustration-hand-drawn-56384568.jpg
"the taj mahal, uttar, india by the window, with the flag and the word'india '",https://cdn.shopify.com/s/files/1/1134/2550/products/the-taj-mahal-in-fog-photo-printed-picture-roller-blind-rb578-photo-roller-blinds-art-fever-380127_large.jpg?v=1574435081
the taj mahal mahal famous building in india stock illustration,https://thumbs.dreamstime.com/b/drawing-sketch-illustration-taj-mahal-famous-monument-india-drawing-sketch-illustration-taj-mahal-165259584.jpg
the taj mahal in india is seen through the garden of its house,https://worldexpeditions.com/croppedImages/Indian-Sub-Continent/India/Taj-Mahal-Agra-India-552665-1920px-16x7.jpg
the architecture of taj mahal is beautiful,https://img.freepik.com/free-photo/close-up-view-taj-mahal-mausoleum-agra-india_92397-335.jpg?size=626&ext=jpg
"the taj mahal palace hotel, goa",https://cdn.jonbainestours.com/images/tours/India/_crop400/India-Oberoi-Hotel-Kolkata.jpg
"the front entrance to the taj mahal mosque in agra, uttar",https://marwarology.files.wordpress.com/2013/03/dsc01760.jpg?w=584&h=779
"the taj mahal in india, a white stone building with an ornate dome and columns",http://www.tropicalisland.de/india/uttar_pradesh/agra/images/AGR%20Agra%20-%20Taj%20Mahal%20building%20with%20detail%20of%20decorative%20white%20minaret%20on%20corner%20of%20the%20platform%203008x2000.jpg
the exterior of the taj mahal with its dome and minams,https://ak8.picdn.net/shutterstock/videos/29929348/thumb/1.jpg
two women sitting on steps in front of the taj mahal building,https://theatlasheart.com/wp-content/uploads/2018/04/TajMahalEdited-128.jpg
"the taj mahal, with its magnificent architectural details","https://ih1.redbubble.net/image.558243207.2978/poster,504x498,f8f8f8-pad,600x600,f8f8f8.u3.jpg"
the taj mahal from the window of the mausoleum at sunrise,https://i.pinimg.com/736x/d7/ee/1b/d7ee1b8da3785c943bae6ab1c7e29db0--india-travel-agra.jpg
"an indian symbol, made on the background of a taj mahal, the indian flag illustration",https://us.123rf.com/450wm/alyonkalis/alyonkalis1604/alyonkalis160400011/54974649-colorful-hand-lettering-is-a-poster-on-the-theme-of-travel-and-adventure-abroad-familiarity-with-the.jpg?ver=6
"the garden of the taj mahal, agra",http://untoldstory.in/wp-content/uploads/2017/05/taj-mahal-1883.jpg
"the taj mahal, mausoleum with reflection in the water",https://c1.wallpaperflare.com/preview/232/786/346/india-the-taj-mahal-monuments.jpg
"the taj mahal, in india, is one of the most recognizable sights on earth",https://english.cdn.zeenews.com/sites/default/files/styles/zm_700x400/public/2018/09/25/722630-taj-mahal.jpg
a girl in red dress stands outside of an archway and looks at the taj mahal,https://www.sunshineseeker.com/wp-content/uploads/2018/10/Taj-Mahal-Photography-Tips-View-Mosque.jpg
the restaurant at taj mahal resort,https://pix6.agoda.net/hotelImages/154/154801/154801_110331174839267.jpg?s=800x
the taj mahal mahal hotel in mumbai city maharashtra,https://previews.agefotostock.com/previewimage/medibigoff/b6aaafd424f3551443a28d479c697557/dpa-vda-78892.jpg
"tourists walking through the courtyards in front of the taj mahal, a mughal era building in agra agra",https://lp-cms-production.imgix.net/image_browser/Taj_Mahal_Agra_S.jpg?auto=format&fit=crop&q=40&sharp=10&vib=20&ixlib=react-8.6.4
"a woman taking a photo in front of the taj mahal mosque, one of the most known buildings in",https://www.thatsnotus.com/g/018-taj-mahal-essay-on-promoting-tourism-1024x673.jpg
"the taj mahal, mausoleum, and water canal in the foreground",https://c4.wallpaperflare.com/wallpaper/778/535/597/india-taj-mahal-the-mausoleum-agra-wallpaper-preview.jpg
"the taj mahal mosque and its minams, uttar",http://static.flickr.com/2766/4253432263_2fe0c92c30.jpg
"the taj mahal is a white marble palace, located in agra, uttar, india it has seven domes",https://thumb9.shutterstock.com/display_pic_with_logo/322090/296447276/stock-vector-taj-mahal-famous-indian-landmark-with-white-marble-mausoleum-central-domed-tomb-minarets-on-both-296447276.jpg
"the taj mahal, mausoleum and doorways from inside",https://images.odysseytours.net/article/21000/taj-mahal-a-view-from-the-mosque_18268.jpg
"the taj mahal mosque in agra, india",https://slideplayer.com/slide/6430698/22/images/59/Taj+Mahal+%281650%29+Mausoleum+for+Mumtaz+Mahal+%28took+an+active+political+role+in+Mughal+court%29+built+by+her+husband+Shah+Jahan..jpg
the taj mahal mausoleum in paradise,https://slideplayer.com/slide/256271/1/images/3/A+mausoleum+in+paradise%3A+Monumental+tombs+were+not+part+of+either+the+Hindu+or+Buddhist+traditions%2C+but+had+a+long+history+in+Islamic+architecture.+In+India%2C+the+Mughal+Shah+Jahan+built+the+famous+Taj+Mahal..jpg
"an incredible taj mahal, india by person",http://media1.santabanta.com/full5/Architecture/TajMahal/tajmahal-56a.jpg
"the taj mahal mosque in india, which was designed by renowned architect person",https://cdn.downtoearth.org.in/uploads/0.24972300_1437654414_1.jpg
an indian couple posing for the camera outside of the taj mahal hotel in mumbai,https://theweddingbrigade.s3.amazonaws.com/media/photologue/photo/59ca7486-47e0-4054-97b8-b39509f20216.jpg
the taj mahal in india the tower of the building is the mausoleum,http://static.flickr.com/4025/4713422517_05535c7766.jpg
the taj mahal palace in mumbai,https://media.weddingz.in/images/f15f475aea8fd7df6f292edbe32b2efe/148636425.jpg
"an image of the taj mahal mausoleum in agra, india",http://www.great-er.org/img/worlds_most_popular_tourist_attractions.jpg
"the taj mahal on the bank of yamun river, india stock images",https://thumbs.dreamstime.com/b/bank-yamuna-river-covered-garbage-taj-mahal-fog-background-agra-uttar-pradesh-india-was-91413024.jpg
"the taj mahal, india mosque with its reflection in the pool",https://julianraxworthy.org/wp-content/uploads/2018/01/A-Short-History-of-the-Taj-Mahal-Garden-816x459.jpg
"a beautiful and famous taj mahal, an ancient hindu temple in india",https://storage.googleapis.com/picxystatic/cache/2018/12/23/bee0dfd1626cca2ee57a4ac11747ef90.jpg
the table is set for guests at the taj mahals,https://lirp-cdn.multiscreensite.com/afde8c67/dms3rep/multi/opt/498-768x514-640w.jpg
a taj mahal in agra a egbyt b china c turkey d india,https://images.slideplayer.com/14/4438380/slides/slide_60.jpg
the taj mahal palace hotel in mumbai,https://media-cdn.tripadvisor.com/media/photo-s/0d/97/fe/18/indian-restaurant-inside.jpg
two women dressed in sari are walking in front of the taj mahal temple,https://q-cf.bstatic.com/data/xphoto/1182x887/204/20439349.jpg?size=S
"a hallway of the taj mahal, the pink marble palace in agra, agra, india, featuring gilded",https://cdn.shopify.com/s/files/1/0898/1228/products/127602548_x700.jpg?v=1537105056
"the taj mahal mausoleum in sunrise light, with reflecting water and trees",https://images.robertharding.com/preview/RM/RH/HORIZONTAL/1161-4645.jpg
the group at the taj mahal mausoleum,https://images.squarespace-cdn.com/content/v1/578432fa37c581b33140f91c/1479862007515-3U74E1BX8LRX0D5H8OUE/ke17ZwdGBToddI8pDm48kPoswlzjSVMM-SxOp7CV59BZw-zPPgdn4jUwVcJE1ZvWQUxwkmyExglNqGp0IvTJZamWLI2zvYWH8K3-s_4yszcp2ryTI0HqTOaaUohrI8PIeQMKeWYgwh6Mn73n2eZmZLHHpcPIxgL2SArp_rN2M_AKMshLAGzx4R3EDFOm1kBS/I-will-send-you-a-few-photos-to-be-added-to-the-personal-section..jpg?format=1500w
"the interior of the taj mahal mahal mosque, which was built in 17277, it is one of",https://thumbs.dreamstime.com/b/details-intricate-carvings-around-rang-mahal-inside-red-fort-delhi-india-unesco-world-heritage-sites-140335710.jpg
the taj mahal in india hand lettering inscription royalty illustration,https://thumbs.dreamstime.com/b/seamless-pattern-agra-label-hand-drawn-taj-mahal-seamless-pattern-agra-label-hand-drawn-taj-mahal-lettering-agra-121274694.jpg
a man walks near the large wall at the taj mahal agra,http://static.flickr.com/2171/2151481673_6bc410954b.jpg
"the taj mahal mausoleum, seen from a building on the side of the road in india",http://static.flickr.com/2793/4041964539_021b035d0b.jpg
a very pretty mughal garden in front of the taj mahal,https://i.pinimg.com/736x/d0/54/b8/d054b821114b143bd550ddecd09b80bd--out-to-to-the.jpg
the famous taj mahal building on white background royalty illustration,https://thumbs.dreamstime.com/b/vector-mosque-white-background-illustration-architecture-muslim-73381822.jpg
the taj mahal white marble mausoleum viewed from a window,http://l7.alamy.com/zooms/7c910f6b5c174b598f4ed6098aa318b0/the-taj-mahal-as-seen-through-a-window-of-the-red-fort-h362w8.jpg
the living room at the taj mahal mahal in delhi,https://i.pinimg.com/736x/f7/aa/6a/f7aa6af93504751d75b005505d77260d--vanderbilt-houses-cornelius-vanderbilt.jpg
the taj mahal in india with water and reflection,https://img-aws.ehowcdn.com/560x560p/photos.demandstudios.com/getty/article/178/232/92834693.jpg
the taj mahal is the world's most recognizable building,https://c1.wallpaperflare.com/preview/409/436/63/1890-photos-historic-india.jpg
the taj mahal mosque in india,http://www.traveladventures.org/countries/india/images/taj-mahal05.jpg
the taj mahal palace on lake picholam in udai rajasthan india,https://media.gettyimages.com/photos/the-lake-palace-hotel-jag-niwas-on-island-site-on-lake-pichola-in-picture-id136860999?s=612x612
the taj mahal building in agra,https://images.slideplayer.com/31/9761025/slides/slide_22.jpg
the taj mahal hotel with boats at the edge of river ganges on the arabian river in mumbai india,https://media.gettyimages.com/photos/the-taj-mahal-palace-hotel-in-the-suburb-colaba-with-some-ferryboats-picture-id463200605?s=612x612
"the main lobby at taj mahal palace, india",https://t-ec.bstatic.com/images/hotel/max1024x768/114/114287055.jpg
"the taj mahal palace hotel, jaipur",https://media-cdn.tripadvisor.com/media/photo-s/0a/a0/7e/58/the-leela-palace-udaipur.jpg
queen diana and her husband prince william visit the taj mahal palace,https://media.gettyimages.com/photos/diana-princess-of-wales-meets-people-during-a-visit-to-the-taj-mahal-picture-id79730616?s=612x612
a bed or beds in a room at the taj mahal hotel,https://www.theluxevoyager.com/wp-content/uploads/2019/04/The-Imperial-New-Delhi-The-Imperial-Room-600x450.jpg
"the taj mahal palace hotel in india, heritage architecture",https://c0.wallpaperflare.com/preview/822/804/921/the-taj-mahal-palace-hotel-photo.jpg
the taj mahal palace hotel,https://vistapointe.net/images/the-taj-mahal-palace-hotel-wallpaper-15.jpg
family dining in front of the taj mahal restaurant,https://www.merithotels.com/assets/images/restaurant/Bluesea/12.jpg
the interior of taj mahal mahal mausoleum agra uttar india,https://media.gettyimages.com/photos/the-taj-mahal-mausoleum-marble-tomb-caskets-of-shah-jahan-and-mumtaz-picture-id134642117?s=612x612
the taj mahal mausoleum in agra uttar india,https://media.gettyimages.com/photos/details-of-the-most-beautiful-building-of-the-world-the-taj-mahal-picture-id158657277?s=612x612
"the taj mahal, india from an arch",https://static1.squarespace.com/static/58c130891e5b6c713809b344/58c130d917bffc0ccda66710/5974ad512e69cf20a27f6dd4/1500819095251/DSC01942.JPG?format=1500w
the grand suite of the taj mahal hotel in amritpur,https://pix6.agoda.net/hotelImages/154/154801/154801_16083019330045937130.jpg?s=800x
"an indian village along the river, with the taj mahal mausoleum on the other side",https://ssl.c.photoshelter.com/img-get/I0000higjyYhLRdU/s/880/704/Taj-Mahal-Yamuna-rubbish-garbage-0060.jpg
black and white photography with the taj mahal,http://www.dailytravelphotos.com/images/2009/091229_agra_india_taj_mahal_rear_view_back_jamuna_river_travel_photography_MG_8765.jpg
the taj mahal at rainy day,https://media-cdn.tripadvisor.com/media/photo-s/05/0b/a5/a7/taj-mahal.jpg
the taj mahal mosque in india,https://thumbs.dreamstime.com/b/red-building-next-to-taj-mahal-east-west-have-picture-also-very-beautiful-guards-both-sides-48123031.jpg
a courtyard garden and the gardens of the taj mahal mahal mahal mahal mahal,http://www.lovethesepics.com/wp-content/uploads/2012/02/Taj-Lake-Palace-begun-as-a-prince%E2%80%99s-rebellious-gesture-but-was-turned-into-one-of-the-most-romantic-hotels-in-the-world1.jpg
the taj mahal hotel new delhi,https://i.ytimg.com/vi/zkTGDEmaogw/maxresdefault.jpg
"the taj mahal, the first monument of the world in india silhouette",https://img.rawpixel.com/s3fs-private/rawpixel_images/website_content/v283-sasi-tree-11_2.jpg?auto=format&bg=transparent&con=3&cs=srgb&dpr=1&fm=jpg&ixlib=php-3.1.0&mark=rawpixel-watermark.png&markalpha=90&markpad=13&markscale=10&markx=25&q=75&usm=15&vib=3&w=1400&s=c17cdd5c8ad303cd832d27d686704a23
the taj mahal and a lake,http://static.flickr.com/4079/4912921770_3c9c90bee8.jpg
women are playing on the floor of the taj mahal,https://thumbs.dreamstime.com/b/jama-masjid-mosque-old-delhi-india-november-muslim-pilgrim-family-visiting-november-dehli-largest-33910032.jpg
"the taj mahal, a famous landmark in india illustration",https://thumbs.dreamstime.com/b/taj-mahal-mausoleum-agra-famous-monument-india-vector-illustration-taj-mahal-mausoleum-agra-famous-monument-india-104465887.jpg
the dome of the taj mahal and blue sky,https://storage.googleapis.com/picxystatic/cache/2018/12/23/bc1ad00209ae591b2404fb520ee77011.jpg
woman with her hands in the air and her hands extended in front of the taj mahal,"https://res.cloudinary.com/tourhq/image/upload/c_fill,fl_progressive,g_center,h_493,q_auto:best,w_876/jrvpzwhs9cimoz7sdiy9"
some birds flying above the taj mahal,http://static.flickr.com/3188/2301685220_fa586d8abd.jpg
the taj mahal agrala watercolor painting,https://thumbs.dreamstime.com/b/drawing-taj-mahal-agra-india-watercolor-pen-55907410.jpg
the sunset at taj mahal,https://img.rawpixel.com/s3fs-private/rawpixel_images/website_content/k-in-tajmahalsunset.jpg?w=800&dpr=1&fit=default&crop=default&auto=format&fm=pjpg&q=75&vib=3&con=3&usm=15&bg=F4F4F3&ixlib=js-2.2.1&s=82f158b3a3294cf1b30446c2065158c0
the ornate walls and carvings on the taj mahal mosque,https://i.pinimg.com/originals/c4/be/1d/c4be1dbf820cbdba5cc39de1a8b08b16.jpg
characters person and the taj mahal monument news photo,https://media.gettyimages.com/photos/disney-cartoon-characters-phineas-and-ferb-pose-in-front-of-the-taj-picture-id125661899
"the taj mahal from the reflecting pool, agra agra agra agra agra",https://live.staticflickr.com/3327/3491552375_a1646b8df8_b.jpg
the golden triangle with a girl in front of taj mahal,https://www.intrepidtravel.com/sites/intrepid/files/styles/low-quality/public/elements/product/hero/HHSC_india_agra_taj-mahal_pax-smile.jpg
"the taj mahal viewed from inside of an archway in the akbar mausoleum at sunrise, uttar, india",http://www.traveladventures.org/countries/india/images/taj-mahal06.jpg
the taj mahal mausoleum,https://www.re-thinkingthefuture.com/wp-content/uploads/2018/03/Taj-Mahal-IndiaAgra.jpg
a dome and top of the taj mahal agra mosque in uttar pradesh india,https://www.featurepics.com//StockImage/20080902/mahal-dome-stock-photo-878151.jpg
taj mahal mausoleum with a blue sky background stock images,https://thumbs.dreamstime.com/b/taj-mahal-most-famous-monument-india-agra-uttar-pradesh-taj-mahal-unesco-world-heritage-site-most-famous-114040269.jpg
"the taj mahal madras mosque in agra, agra, india",https://foodtravelsandmore.files.wordpress.com/2017/07/dsc1011.jpg?w=736
"three women stand on the taj mahal mosque, with their heads tilted in the air",https://thetravelintern.com/wp-content/uploads/2016/07/Taj-Mahal-Photography-Guide-8.jpg
boats moored in front of the taj mahal palace,https://www.outlookindia.com/outlooktraveller/public/uploads/2018/06/Udaipur1_TI_Final.jpg
woman sitting on bench in front of the taj mahal,https://www.indianpanorama.in/images/photo-gallery/taj-mahal/taj-mahal-foreigner-pics.jpg
the taj mahal vector illustration royalty illustration,https://thumbs.dreamstime.com/b/vector-illustration-hagia-sophia-church-istanbul-turkey-hand-drawn-illustration-ancient-building-vector-outlined-163874106.jpg
the marble columns of the taj mahal agra hotel in india,https://thumbs.dreamstime.com/b/agra-fort-th-century-mughal-architectural-masterpiece-precious-stones-pillar-diwan-i-khas-97965824.jpg
a woman in sari near the taj mahal with a camel in the water,https://t1.thpservices.com/previewimage/gallil/87675778a81c0162810581ed8fee4a19/pnm-pirm-20071226-jh2101.jpg
tourists wearing protective face masks while visiting the taj mahal agra in india,https://images.assettype.com/freepressjournal%2F2020-03%2F91ed71f6-2d10-48f9-87bc-5a95f976b659%2FCoronavirus2.jpg?w=1200
the taj mahal from boat on the yamuna river,https://img.freepik.com/free-photo/man-watching-sunset-taj-mahal-from-wooden-boat-with-bird-flying_42667-753.jpg?size=626&ext=jpg
taj mahal mosque india vector illustration royalty illustration,https://thumbs.dreamstime.com/b/immense-mausoleum-white-marble-built-agra-order-mughal-emperor-shah-jahan-memory-his-favourite-wife-154595476.jpg
"a woman walking in front of the taj mahal, india",http://d27k8xmh3cuzik.cloudfront.net/wp-content/uploads/2017/01/tajmahal-1.jpg
a miniature white taj mahal at a wedding cake,https://hctg-images.imgix.net/images/real-weddings/wedding-cakes-and-confections-by-freedom-bakery/sculptedweddingcake8.jpg?fit=clip&q=80&w=1000&s=a5e0c2b1ff5d2b8d09ebe564a1c5f8e9
the taj mahal palace is lit up in blue at night,https://www.wowvenue.com/public/uploads/venue/The-Leela-Palace-Udaipur-India-1.jpg
marble detail of the taj mahal,https://images.slideplayer.com/42/11551005/slides/slide_24.jpg
"sunset over the taj mahal, a mughal era palace in the city of agra",https://storage.googleapis.com/picxystatic/cache/2018/7/19/22fd6e9dae726c8586e69c0d7f66fc0a.jpg
the taj mahal in india on a foggy day,https://i1.wp.com/parthatravelogue.blog/wp-content/uploads/2018/06/img_1973.jpeg?resize=760%2C507&ssl=1
"the taj mahal mahal mahal hotel, mumbai mumbai, mumbai india",https://www.myboutiquehotel.com/photos/6849/the-taj-mahal-palace-mumbai-068-49761-960x600.jpg
"the taj mahal, india's tomb of mausoleums and minages, is shown from inside an",https://images.livemint.com/rf/Image-621x414/LiveMint/Period2/2017/10/27/Photos/Processed/taj-kyr--621x414@LiveMint.jpg
the taj mahal or white marble mausoleum and view from inside the mausoleum,https://media.gettyimages.com/photos/taj-mahal-in-morning-light-seen-from-the-arches-of-an-old-ruined-picture-id890118244?s=612x612
the taj mahal on the background of the sky and clouds hand drawn vector illustration stock vector 94169,https://us.123rf.com/450wm/lookus/lookus1904/lookus190400118/121414610-stock-vector-the-taj-mahal-agra-india-vector-freehand-pencil-sketch-.jpg?ver=6
birds flying in front of the taj mahal,https://cdn1.i-scmp.com/sites/default/files/styles/768x768/public/2014/11/29/aga01d_6074991.jpg?itok=g3BDBySG
the taj mahal mahal palace from across the bay,https://lonelyplanetimages.imgix.net/a/g/hi/t/ab5c55eb6f981026230a95dfb052a51d-taj-mahal-palace-mumbai.jpg
