caption,url
the taj mahal mausoleum with a view into the trees stock photography,https://thumbs.dreamstime.com/b/one-india-most-famous-tourist-place-taj-mahal-one-india-most-famous-tourist-place-taj-mahal-agra-164543052.jpg
the taj mahal white monument made by person for his deceased wife,https://slideplayer.com/slide/14335790/89/images/11/Taj+Mahal+White+monument+made+by+a+Mughal+emperor+for+his+deceased+wife..jpg
the marble tile is one of the highlights in the taj mahal mausoleum,https://render.fineartamerica.com/images/images-profile-flow/400/images-medium-large-5/carvings-on-the-marble-wall-taj-mahal-visage.jpg
the taj mahal mahal vector illustration,https://thumbs.dreamstime.com/b/taj-mahal-agra-india-around-world-travel-tourism-east-taj-mahal-agra-india-travel-106551558.jpg
the taj mahal hotel from the river,https://wallpapercave.com/wp/wp3608385.jpg
the taj mahal from the boat on the river,https://static2.tripoto.com/media/filter/tst/img/522191/TripDocument/1551871465_379100.jpg
taj mahal sketch on white,https://us.123rf.com/450wm/lookus/lookus1904/lookus190400126/121414635-stock-vector-the-taj-mahal-agra-india-vector-freehand-pencil-sketch-.jpg?ver=6
tourists standing in line at the taj mahal,https://theimageflow.com/wp-content/gallery/india-photography-expedition/workshop-india-photography-expedition-62348.jpg
the taj mahal or mosque in the city of agra agra pradesh india,https://media.gettyimages.com/photos/the-taj-mahal-is-reflected-in-water-pooled-in-a-polluted-ditch-on-the-picture-id954424608?s=612x612
students on a trip to the taj mahal in india,https://i1.wp.com/abroadabroadtravel.com/wp-content/uploads/2013/12/2013-12-16-17-58-53.jpg?resize=606%2C605
"tourists at the taj mahal, which is considered by the locals stock images",https://thumbs.dreamstime.com/b/indian-tourist-taj-mahal-agra-india-oct-people-visit-oct-mausoleum-located-one-most-30780213.jpg
"shadows and light from windows in an ornate room inside the taj mahal mosque, jam mosque, jam masjid",https://i.pinimg.com/originals/27/6c/7e/276c7ec70d0e31c75363ead25fa08717.jpg
"the taj mahal hotel in agra, uttar",http://dailynewsdig.com/wp-content/uploads/2014/01/Hotel-Rooms-With-The-Most-Amazing-Views-in-The-World-4.jpg
taj mahal mausoleum on the river bank in india hand drawn illustration,https://image.shutterstock.com/image-vector/drawing-sketch-illustration-taj-mahal-600w-1573748011.jpg
a swimming pool at the taj mahal resort,http://www.oimfashion.com/wp-content/uploads/2016/03/royal4.jpg
tourists taking pictures and photographs of the taj mahal mausoleum on the banks of the yamun river in india,https://media.gettyimages.com/photos/tourists-taking-photographs-at-the-taj-mahal-mausoleum-southern-view-picture-id134643776?s=612x612
the taj mahal and the agra river at sunrise,https://thrillingtravel.in/wp-content/uploads/2018/01/IMG_1745-Edit-2.jpg
"a woman sitting on some steps in front of the taj mahal mausoleum in agra, india acrylic",https://render.fineartamerica.com/images/rendered/medium/acrylic-print/metalposts/break/images-medium-5/veruschka-wearing-a-teal-traina-dress-henry-clarke.jpg
"women in colorful clothing pose for a photo at taj mahal mahal, uttar pradesh, india",https://www.robertharding.com/watermark.php?type=preview&im=RM/RH/HORIZONTAL/1218-331
"the taj mahal india mosque to honor wife of shah person, the white marble tomb",https://images.slideplayer.com/11/3112944/slides/slide_9.jpg
the silhouette of a man on the taj mahal framed print,https://render.fineartamerica.com/images/images-profile-flow/400/images-medium-large-5/a-woman-stands-near-the-famous-taj-simon-odwyer.jpg
"the taj mahal, the white marble mausoleum of the taj mahal agra",https://bearsinwanderlust.files.wordpress.com/2017/07/dsc_9396.jpg?w=1200
a girl sitting on the wall looking at the taj mahal,http://i.dailymail.co.uk/i/pix/2017/10/30/01/45D1548F00000578-5030091-image-a-2_1509325697967.jpg
tourists taking pictures at the taj mahal with a sky background,https://cdn1.i-scmp.com/sites/default/files/styles/768x768/public/images/methode/2017/12/28/b6a87e6c-eb9f-11e7-8d3e-3515408466a8_1280x720_155518.JPG?itok=knRByTpD
the taj mahal mausoleum is shrouded in a layer of fog in this december 2009 file photo,https://i0.wp.com/comedytravelwriting.com/wp-content/uploads/2020/03/DSC_0206-scaled.jpg?fit=1024%2C683&ssl=1
"the taj mahal tower in agra, india",https://t1.thpservices.com/previewimage/gallil/45bd6caec6b5b87f2e6eb1fe2fe65922/x7f-2817316.jpg
bollywood actor person poses for a profile shoot at the taj mahal mahalr on march 23 2019 in new,https://media.gettyimages.com/photos/bollywood-actor-gurmeet-choudhary-poses-for-a-profile-shoot-during-picture-id1036678656?s=612x612
"the taj mahal, known as the red stone mausoleum in india",https://i.pinimg.com/originals/79/99/e4/7999e485eaabfcb3b3c0b190037665e2.jpg
the taj mahal and its reflection on the river yamun,https://media.gettyimages.com/photos/taj-mahal-and-reflection-in-morning-light-seen-from-across-the-yamuna-picture-id890118230?s=612x612
a lego moc made to look like the taj mahal agrala,https://i.pinimg.com/originals/1a/96/d7/1a96d74310d762b930834013c782a0a9.jpg
flowers at the taj mahal mausoleum,https://media.gettyimages.com/photos/shot-of-bloomed-flowers-at-the-mughal-gardens-in-new-delhi-picture-id1199790109?s=612x612
an arched arch at the entrance of the taj mahal,http://www.traveladventures.org/countries/india/images/taj-mahal15.jpg
"wall decoration with floral motif in marble in the taj mahal agra fort, uttar",https://image.shutterstock.com/image-photo/pietra-dura-style-on-walls-600w-1153338205.jpg
the taj mahal mausoleum seen from the sky,https://i2.wp.com/static3.businessinsider.com/image/5512ce49ecad044b4cadc587-1200/photographer-amos-chapple-captures-the-worlds-most-famous-landmarks--from-the-taj-mahal-to-the-kremlin--using-a-drone.jpg
"the taj mahal agrala, with it's two towers",https://ak1.picdn.net/shutterstock/videos/24424091/thumb/1.jpg?i10c=img.resize(height:160)
a woman dancing in front of the taj mahal mosque in india,https://www.intrepidtravel.com/sites/intrepid/files/styles/low-quality/public/Intrepid%20Travel-india_taj-mahal_traveller-sunrise_4.jpg
the taj mahal at sunrise from the banks of the yamunla,https://images.robertharding.com/preview/RM/RH/HORIZONTAL/557-2985.jpg
a 3d model of the taj mahal from pakistan in white and gold,https://farm8.staticflickr.com/7243/7278399902_33e269a85e_b.jpg
"an illustration of the taj mahal, india",https://i.pinimg.com/originals/5d/25/74/5d257444fcab9bc77717be1dc5373cd3.jpg
"the taj mahal, a white marble building in india",https://i2.wp.com/www.billyscities.com/wp-content/uploads/2019/06/IMG_4013_edited-e1562877519125.jpg?resize=640%2C480&ssl=1
a camel standing in front of the taj mahal mosque,http://l7.alamy.com/zooms/4e9e691139c147948cefff6f1957f9f5/close-up-of-a-young-man-riding-a-camel-a10m0j.jpg
tourists taking pictures at the taj mahal mausoleum in agra,https://static1.squarespace.com/static/56ec44b41d07c0db86a517e5/t/58b7d67920099e5e74ed1c12/1491112894803/best-photo-spots-taj-mahal.jpg
the taj mahal mosque in india with red flowers and green trees,https://thumbs.dreamstime.com/b/india-has-rich-varied-history-dating-back-to-s-years-ago-same-reason-there-several-tourist-attractions-165802933.jpg
the taj mahal palace,https://2.bp.blogspot.com/-PNpLYBfjDN4/WpymXFOFPdI/AAAAAAAArFk/orY5E_P5hLsdi4SK1n5vZp0NENKQgxnHQCLcBGAs/s1600/Taj%2BMahal%2BPalace%2BMumbai%2BHotel%2B-%2BPosh%252C%2BBroke%252C%2B%2526%2BBored_1.JPG
the taj mahal mausoleum in the moonlight,https://i.pinimg.com/736x/c9/4b/34/c94b345cc147d8d8f280960fbba4bfd7--moon-magic-super-moon.jpg
"the taj mahal with the main column and minace, with many trees",http://www.theresident.co.uk/wp-content/uploads/sites/10/2017/01/Taj-Mahal-India.jpg
a beautiful woman in white leaning against the taj mahal,https://render.fineartamerica.com/images/rendered/medium/metal-print/images-medium-5/veruschka-wearing-a-teal-traina-dress-henry-clarke.jpg
the taj mahal design on the front of the mosque,https://image.shutterstock.com/image-vector/silhouette-taj-mahal-filled-flowers-600w-1552691588.jpg
the taj mahal in colorful indian style art,https://i.pinimg.com/originals/76/1d/b8/761db8748c2cdef0d6e8056e66ffb18c.jpg
"the taj mahal or mausoleum in agra, india",https://ak6.picdn.net/shutterstock/videos/26814016/thumb/11.jpg
"the reflection in the water at the taj mahal mausoleum, uttar, india",https://img-s-msn-com.akamaized.net/tenant/amp/entityid/AACLGoB.img?h=0&w=720&m=6&q=60&u=t&o=f&l=f
drawing in line in the taj mahal design,https://i.pinimg.com/originals/f7/f8/e1/f7f8e13a7131650582f975eacc9bc378.jpg
"the taj mahal, the marble and white mosque of the taj mahal complex",https://ineedafunnyblogname.files.wordpress.com/2013/12/img_8507.jpg?w=750&h=500
"india flag with taj mahal, famous monument of india royalty illustration",https://thumbs.dreamstime.com/b/banner-restaurant-indian-cuisine-taj-mahal-vector-flag-91100950.jpg
"women walking in front of the taj mahal mosque in agra, india stock images",https://thumbs.dreamstime.com/b/tourists-entering-great-gate-to-taj-mahal-26631923.jpg
a woman in a green dress takes photos of the taj mahal on a sunny day,https://www.thatsnotus.com/g/018-taj-mahal-essay-on-promoting-tourism-868x571.jpg
the taj mahal mausoleum with its towers in fog,https://cdn.civitatis.com/india/agra/galeria/jardin-taj-mahal.jpg
"floral wall panels at the taj mahal palace in agra, uttar",https://i.pinimg.com/originals/60/b7/58/60b758ac1aed9835613b9199f856b6f1.jpg
"the taj mahal temple in agra, uttar pradesh india",https://i.pinimg.com/originals/18/1e/46/181e46da34488f7aa7d43955f75c6463.jpg
"the taj mahal, the largest building in india, is a historic monument that is situated in agra uttar",https://st2.depositphotos.com/1319708/11231/v/450/depositphotos_112315472-stock-illustration-side-view-of-the-taj.jpg
"the dining room at the taj mahal sahib palace, a palace in uttar, is one of the biggest",https://theweddingbrigade.s3.amazonaws.com/media/photologue/photo/47aef22a-bec4-4672-b2a4-70619fe1c2dc.jpg
white marble with flowers inlaid to the walls of the taj mahal mausoleum,http://static.flickr.com/3224/2652506789_1b8ec2fbe5.jpg
the taj mahal as seen from across a reflecting pool in front of it,https://thepointsguy.com/wp-content/uploads/2015/07/TajWide.jpg
the dome on the top of the taj mahal mosque,https://photos.travelblog.org/Photos/14290/104766/f/706855-Detail-of-the-dome-of-the-Taj-Mahal-1.jpg
a young woman stands in front of the taj mahal building,https://66.media.tumblr.com/356db4150c180e85b61a5c985fc04258/tumblr_mi6c5bmJhH1qz4g1zo1_1280.jpg
"a close up of the taj mahal, showing the intricate carvings and detailing",http://i.dailymail.co.uk/i/pix/2014/10/06/1412591645318_wps_9_A_complex_recreation_of_t.jpg
the taj mahal the greatest example of mughal architecture is the taj mahal which was built in 1334,https://images.slideplayer.com/32/9909273/slides/slide_18.jpg
an ornate window at the entrance to the taj mahal,https://i.pinimg.com/originals/de/30/83/de3083154a4e264bc23d15d0768a29d8.jpg
the taj mahal mausoleum at sunrise on the banks of the yamun river,https://images.squarespace-cdn.com/content/v1/5c180094a9e028ac5301d51c/1560532207521-47HIDFFQUSCNDNQPBDV9/ke17ZwdGBToddI8pDm48kG87Sfbgg29A4BYEDq3OXvgUqsxRUqqbr1mOJYKfIPR7LoDQ9mXPOjoJoqy81S2I8N_N4V1vUb5AoIIIbLZhVYxCRW4BPu10St3TBAUQYVKcf4OxbJOyh_wHUnyc4kQLQ6SBshRGOku7c30Y_IRDNPta8R2IY5BHMaEj1zOWoDTZ/Photographing+Taj+Mahal-sunrise+photo+spot.jpg?format=1000w
"the taj mahal a white marble mausoleum located in agra, india",https://slideplayer.com/slide/13036736/79/images/54/The+Taj+Mahal+-+crown+of+palaces+%2C+is+a+white+marble+mausoleum+located+in+Agra%2C+India..jpg
a taj mahal monument built as a memorial to person,https://images.slideplayer.com/29/9440286/slides/slide_16.jpg
"the taj mahal, as seen from a water body",https://www.outlookindia.com/outlooktraveller/public/uploads/filemanager/images/Taj-Mahal_5d89fdac76d77.jpg
"the taj mahal hotel, mumbai",https://i.pinimg.com/originals/0d/f0/f1/0df0f188df5b887d3962f9958ba51e9c.jpg
"the taj mahal, built as a monument and one of the largest buildings in the world",https://thumbs.dreamstime.com/b/taj-mahal-unesco-world-heritage-site-most-famous-monument-india-agra-city-uttar-pradesh-state-168382872.jpg
tourists taking photos at the taj mahal agra agra,https://cdn5.img.sputniknews.com/images/105230/45/1052304556.jpg
a sketch of the taj mahal with a man in sunglasses taking pictures of it,https://thumbs.dreamstime.com/b/strichmaennchen-als-tourist-indien-132328591.jpg
"the taj mahal hotel, which has been listed as a landmark by the indian express",https://media-cdn.tripadvisor.com/media/photo-s/04/1a/26/d8/view-of-heritage-wing.jpg
the intricate patterns on the walls of the mausoleum in taj mahal,https://images.odysseytours.net/article/21000/red-sandstone-with-marble-decorations_18270.jpg
"a hallway in the hotel at taj mahal sahib palace, uttar",https://thumbs.dreamstime.com/b/udaipur-india-feb-internal-view-city-palace-magnificently-designed-decorated-interiors-151109944.jpg
"a man in red standing in front of the taj mahal mosque in agra, india",https://static1.squarespace.com/static/5c180094a9e028ac5301d51c/5c18013189858351a8a804ac/5c1a2dbe21c67cd47c4eccbd/1586456432865/Photographing%2BTaj%2BMahal.jpg?format=2500w
"a water feature in the gardens of the taj mahal mausoleum, unesco monument, unesco city of mausoleum,",https://images.robertharding.com/preview/RM/RH/HORIZONTAL/1161-4664.jpg
taj mahal the mausoleum agra india art board print,"https://ih1.redbubble.net/image.1088978949.3715/gbrf,5x7,f,540x540-pad,450x450,f8f8f8.jpg"
"the taj mahal in agra, india",http://www.traveladventures.org/countries/india/images/taj-mahal09.jpg
two girls sitting on the ground in front of taj mahal,https://www.adventureswithchildren.com/wp-content/uploads/2019/04/%C2%A9-Dana-Sikand-2017-2018-All-Rights-Reserved-3743-900x600.jpg
"tourists ride camels on the banks of the yamun river near the taj mahal, the mausoleum of",https://si.wsj.net/public/resources/images/OB-XB355_ipix04_H_20130415002831.jpg
"the taj mahal, with two towers and a large courtyard, in india",https://ak8.picdn.net/shutterstock/videos/28165408/thumb/1.jpg
an overcast sky shows the taj mahal,https://images.robertharding.com/preview/RM/RH/HORIZONTAL/1114-260.jpg
"a boat on the yamuna river near the taj mahal in the distance, with its dome dome",https://www.mediastorehouse.com/p/251/india-view-taj-mahal-reflecting-yamuna-river-15235888.jpg
"marble decoration in the taj mahal, agra pradesh",https://thumbs.dreamstime.com/b/plant-motifs-taj-mahal-exterior-agra-uttar-pradesh-india-decorations-finest-mughal-architecture-139194353.jpg
little girl looking at the taj mahal with birds flying overhead,https://www.sunshineseeker.com/wp-content/uploads/2018/10/Taj-Mahal-Photography-Tips-Important-Information.jpg
the taj mahal mausoleum is shown in india and the world,https://www.thenewsminute.com/sites/default/files/styles/news_detail/public/Taj_Mahal_PTI.jpg?itok=kWBeYIb-
a photograph of the taj mahal mausoleum with gardens in front,https://lookaside.fbsbx.com/lookaside/crawler/media/?media_id=1391390041055174
a silhouetted image of the taj mahal and the reflection on water,https://ak3.picdn.net/shutterstock/videos/1242283/thumb/1.jpg?i10c=img.resize(height:160)
"taj mahal, a white marble mausoleum, is a monument in india",https://as1.ftcdn.net/jpg/02/17/41/18/500_F_217411833_0dGz8V9Nx295r1Lo6AYa3RsxAWxxcQCS.jpg
the taj mahal in india on a blue background with birds in the sky,https://us.123rf.com/450wm/lookus/lookus1904/lookus190400114/121414607-stock-vector-the-taj-mahal-agra-india-vector-freehand-pencil-sketch-.jpg?ver=6
bride and groom in front of the taj mahal hotel,https://www.weddingsutra.com//images/wedding-images/real_wed/featured/ankita-sagar/ankita-sagar-img18.jpg
the taj mahal palace hotel in mumbai,https://2.bp.blogspot.com/-PhyKi2uTtC4/U2jCphjdM0I/AAAAAAAABMw/rvLirR-EEr0/s1600/Taj2.jpg
a flower carved into the marble wall in taj mahal,http://static.flickr.com/47/109603892_fb1dbc0a0b.jpg
"the taj mahal, an architectural monument that has a fountain",https://lh3.googleusercontent.com/PHcY0Wo720N_NEwd5qx4YOuj031R7SmNBmmGdRxlKEbqFU6ZIkwd7PnS5TbvZqohsVeBzuX880wzdQ8XGvx8cw=s750
"the mausoleum on the taj mahal in agra, india",https://media.vanityfair.com/photos/59a5d2a998ea7f027d30ee1e/master/w_1600%2Cc_limit/Princess-Diana-Retrospective-Anniversary-SS29.jpg
taj mahal agrala or white marble palace in india hand drawn sketch of the taj mahal mausoleum and,https://us.123rf.com/450wm/hypnocreative/hypnocreative1912/hypnocreative191200034/134860891-stock-vector-drawing-sketch-illustration-of-taj-mahal-the-famous-monument-in-india.jpg?ver=6
"the taj mahal with the trees and flowers in foreground, agra, uttar, india",https://thumbs.dreamstime.com/b/taj-mahal-agra-india-majestic-shot-back-moon-gardens-51512954.jpg
taj mahal mausoleum and taj mahal temple with inscription let go travel seamless pattern with sketches hand drawing,https://thumbs.dreamstime.com/b/seamless-pattern-agra-label-hand-drawn-taj-mahal-lettering-121271133.jpg
indian women in bright orange and pink clothes carry pitchers of water to the taj mahal,https://images.robertharding.com/preview/RF/RH_M_RF/HORIZONTAL/794-2970.jpg
the taj mahal mausoleum in india,https://www.dar-alifta.org/images/articles/999-6-2014.jpg
"a building at the taj mahal agra agra, uttar",https://www.deccanherald.com/sites/dh/files/styles/article_detail/public/article_images/2018/10/13/taj%20mahal%20reuters-1539429681.jpg?itok=mX1ubrgh
"the view from the doorway to the taj mahal, one of the best tourist attractions in india",https://breathedreamgo.com/wp-content/uploads/2019/05/SS-Taj-Mahal-1200-px-ed-2.jpg
"india's taj mahal mausoleum with the inscription on it vector art, isolated against a white background stock",https://thumbs.dreamstime.com/b/immense-mausoleum-white-marble-built-agra-order-mughal-emperor-shah-jahan-memory-his-favourite-wife-154594554.jpg
the main gate of the taj mahal temple,https://images.robertharding.com/preview/RM/RH/HORIZONTAL/1114-256.jpg
"a large, historical, ancient taj mahal on an iso field with an dome, two towers and a",https://thumbs.dreamstime.com/b/polygonal-building-model-taj-mahal-d-isometric-view-vector-illustration-polygonal-building-model-taj-mahal-d-144404401.jpg
taj mahal is considered to be the greatest architectural achievement in the whole range of indo islamic architecture,https://cf.ppt-online.org/files/slide/p/peTwI2NzrV5MtvyGDKqf9dsh6RiZ8CSUc7HQab/slide-11.jpg
the white marble mausoleum of taj mahal from an arch in front of it,http://thetravelhack.com/wp-content/uploads/2014/03/Taj-Mahal-through-an-arch.jpg
the majestic taj mahal mahal palace hotel mumbai,https://santorinidave.com/wp-content/uploads/2019/09/mumbai-taj-mahal-review.jpg
"a pencil drawing of the taj mahal mahal mahal sahib mosque, peshawar",https://images.fineartamerica.com/images-medium-large-5/taj-mahal-palace-after-the-rains-uma-krishnamoorthy.jpg
"the taj mahal, india sunset",https://wallpapercave.com/wp/iqfeezV.jpg
the taj mahal hotel in downtown mumbai,https://media-cdn.tripadvisor.com/media/photo-s/01/66/75/8b/this-is-the-hotel.jpg
the taj mahal white stone building seen through the window,http://c8.alamy.com/comp/HGMARF/view-of-the-taj-mahal-through-an-exterior-window-in-the-agra-fort-HGMARF.jpg
the taj mahal mausoleum reflected in a reflecting pool,https://t1.thpservices.com/previewimage/gallage/53981c808a79c8c6157d245d02680e6b/rha-1161-4645.jpg
"the roof of the taj mahal, against blue sky in delhi india stock photography",https://thumbs.dreamstime.com/b/detail-dome-taj-mahal-many-birds-flying-circle-detail-dome-taj-mahal-many-birds-flying-159321694.jpg
"the taj mahal mosque, seen from the south bank",https://i.pinimg.com/originals/bc/99/8e/bc998e0ed79769627a89ced17b1c1c02.jpg
"mumbai, india, seen during twilight, the majestic taj mahal hotel is lit up by lanterns and the",https://vistapointe.net/images/the-taj-mahal-palace-hotel-wallpaper-3.jpg
taj mahal in india the image shows the taj mahal in the middle of an old paper with a,https://thumbs.dreamstime.com/b/brush-dirt-happy-eid-blank-template-ramadhan-elegant-grunge-gold-greeting-card-mosque-picture-mubarak-beautiful-118674670.jpg
"the beautiful taj mahal gardens in agra, uttar, india",https://thumbs.dreamstime.com/b/taj-mahal-pool-garden-reflecting-31207623.jpg
the tower of the taj mahal with a red sandstone marble dome,http://static.flickr.com/3414/3424704832_1f4a1e8da3.jpg
a pool in the middle of the taj mahal gardens in agra,https://btarchstone.com/wp-content/uploads/2018/10/iStock-635726296-1000x423.jpg
"the taj mahal, india's white marble mausoleum in the middle of a lush green field",https://thumbs.dreamstime.com/b/view-taj-mahal-mehtab-bagh-gardens-view-taj-mahal-mehtab-bagh-gardens-other-side-yamuna-river-107688962.jpg
"a girl in front of the taj mahal mausoleum in agra, india",https://www.anitahendrieka.com/wp-content/uploads/2017/03/DSC_0333.jpg
"the taj mahal in agra, india with text overlay saying, travel together, mother's day",http://yellowfeatherblog.com/wp-content/uploads/2018/11/Travel-Tuesday_-Visiting-the-Taj-Mahal-1-1.jpg
the architecture of the taj mahal mosque,https://www.indianpanorama.in/images/photo-gallery/taj-mahal/taj-mahal-building-works.jpg
the taj mahal on the horizon,https://www.holidify.com/images/cmsuploads/compressed/agra-_062615053643_20171124222757.jpg
taj mahal with the word world tourism day in the middle of a picture,https://akm-img-a-in.tosshub.com/sites/btmt/images/stories/world_tourism_day_660_092719031608.jpg
a woman smiling at the taj mahal in india,https://resources.stuff.co.nz/content/dam/images/1/q/4/b/j/i/image.related.StuffLandscapeSixteenByNine.710x400.1t34ce.png/1544656766084.jpg
"the taj mahal is a monument in agra pradesh, india",https://slideplayer.com/slide/10393904/35/images/11/This+photograph+shows+2+lines+of+symmetry.+Where+are+they.jpg
"a tower in the middle of the taj mahal, the largest stone building in india",http://static.flickr.com/3163/2918529176_8e29584553.jpg
silhouettes of the taj mahal mosque in india,https://img.rawpixel.com/s3fs-private/rawpixel_images/website_content/v283-sasi-tree-10_2.jpg?w=800&dpr=1&fit=default&crop=default&auto=format&fm=pjpg&q=75&vib=3&con=3&usm=15&bg=F4F4F3&ixlib=js-2.2.1&s=8eca568106826b610f02017e23042776
a woman stands in front of the taj mahal temple,https://i.pinimg.com/originals/33/38/bf/3338bf41b9919ac45f5395637ee6a995.jpg
the taj mahal mausoleum from the front yard,https://cdn.tourradar.com/s3/tour/645x430/164325_b04918db.jpg
"the taj mahal, a white marble mausoleum with blue sky background stock photography",https://thumbs.dreamstime.com/b/taj-mahal-most-famous-monument-india-agra-uttar-pradesh-taj-mahal-unesco-world-heritage-site-most-famous-168382942.jpg
"the taj mahal from the back, with trees and green lawn stock images",https://thumbs.dreamstime.com/b/close-up-details-taj-mahal-famous-unesco-historical-site-love-monument-greatest-white-marble-tomb-india-agra-uttar-close-up-142714092.jpg
"the taj mahal with tourists, delhi",http://res.publicdomainfiles.com/pdf_view/58/13532196017035.jpg
three women clapping together in front of the taj mahal,https://english.cdn.zeenews.com/sites/default/files/styles/zm_700x400/public/2016/07/01/504802-tourism-india.jpg
the taj mahal with fountain in foreground is shown on the other side of the main body of the,https://www.outlookindia.com/outlooktraveller/resizer.php?src=https://www.outlookindia.com/outlooktraveller/public/uploads/files/2015/07/271015130203-Taj-mahal-Crystian-Cruz.jpg&w=500&h=400
the taj mahal with its arches,https://i.pinimg.com/originals/25/1d/41/251d4107847bf53ffb80b4b389d24e68.jpg
the taj mahal mausoleum in india sticker,"https://ih1.redbubble.net/image.196049700.9480/st,small,845x845-pad,1000x1000,f8f8f8.u2.jpg"
a family standing in front of the taj mahal in india,https://us.hola.com/en/imagenes/celebrities/2017122911033/catherine-zeta-jones-michael-douglas-loved-up-taj-mahal/0-18-41/catherine-zeta-jones-t.jpg
the taj mahal mausoleum from the back,https://media.gettyimages.com/photos/taj-mahal-16321654-tomb-of-mumtaz-mahal-wife-of-the-great-mogul-agra-picture-id630810695?s=612x612
the taj mahal behind barbed wire at the banks of the yamunah river on december 23 2013 in,https://media.gettyimages.com/photos/the-most-beautiful-building-of-the-world-the-taj-mahal-for-security-picture-id158657362?s=612x612
the taj mahal mosque obscured in fog,https://i0.wp.com/comedytravelwriting.com/wp-content/uploads/2020/03/DSC_0197-scaled.jpg?fit=1024%2C683&ssl=1
the cover of the book reflections of the taj mahal tribute to fall horn,https://lirp-cdn.multiscreensite.com/ef1a4d2a/dms3rep/multi/opt/ReflectionsOfTheTajMahal-final-640w.jpg
the taj mahal mausoleum as the sun sets over the horizon,https://theimageflow.com/wp-content/gallery/india-photography-expedition/workshop-india-photography-expedition-16-9-4853759.jpg
the taj mahal mahal in sunset,https://img.rawpixel.com/s3fs-private/rawpixel_images/website_content/k-in-tajmahalsunset.jpg?auto=format&bg=transparent&con=3&cs=srgb&dpr=1&fm=jpg&ixlib=php-3.1.0&mark=rawpixel-watermark.png&markalpha=90&markpad=13&markscale=10&markx=25&q=75&usm=15&vib=3&w=1400&s=deff188f974d815c01f60dd91df533b4
"the cover of incredible india the architecture of the taj mahal, one of the most famous monuments in the",https://i5.walmartimages.com/asr/cee3bc78-4b8c-4219-b594-31c8693e6fea_1.989bb00c5d56f9ac59a3b9af5b41c03c.jpeg?odnWidth=612&odnHeight=612&odnBg=ffffff
tourists take photos and videos of the taj mahal temple,https://static01.nyt.com/images/2018/01/02/world/00tajmahal-5/00tajmahal-5-articleLarge.jpg?quality=75&auto=webp&disable=upscale
"the taj mahal, viewed from a boat on the banks of yamun",https://ak1.picdn.net/shutterstock/videos/7629211/thumb/1.jpg
